[INFO] Scanning for projects...
[INFO]                                                                         
[INFO] ------------------------------------------------------------------------
[INFO] Building Jackson-dataformat-XML 2.9.0-SNAPSHOT
[INFO] ------------------------------------------------------------------------
[INFO] 
[INFO] --- maven-enforcer-plugin:1.3.1:enforce (enforce-java) @ jackson-dataformat-xml ---
[INFO] Skipping Rule Enforcement.
[INFO] 
[INFO] --- build-helper-maven-plugin:1.7:add-source (add-generated-sources) @ jackson-dataformat-xml ---
[INFO] Source directory: /root/workspace/FasterXML/jackson-dataformat-xml/231036718/target/generated-sources added.
[INFO] 
[INFO] --- replacer:1.5.2:replace (process-packageVersion) @ jackson-dataformat-xml ---
[INFO] Replacement run on 1 file.
[INFO] 
[INFO] --- maven-resources-plugin:2.6:resources (default-resources) @ jackson-dataformat-xml ---
[INFO] Using 'UTF-8' encoding to copy filtered resources.
[INFO] Copying 4 resources
[INFO] 
[INFO] --- maven-compiler-plugin:3.2:compile (default-compile) @ jackson-dataformat-xml ---
[INFO] Changes detected - recompiling the module!
[INFO] Compiling 36 source files to /root/workspace/FasterXML/jackson-dataformat-xml/231036718/target/classes
[WARNING] bootstrap class path not set in conjunction with -source 1.7
[INFO] 
[INFO] --- maven-resources-plugin:2.6:testResources (default-testResources) @ jackson-dataformat-xml ---
[INFO] Using 'UTF-8' encoding to copy filtered resources.
[INFO] skip non existing resourceDirectory /root/workspace/FasterXML/jackson-dataformat-xml/231036718/src/test/resources
[INFO] 
[INFO] --- maven-compiler-plugin:3.2:testCompile (default-testCompile) @ jackson-dataformat-xml ---
[INFO] Nothing to compile - all classes are up to date
[INFO] 
[INFO] --- maven-surefire-plugin:2.17:test (default-test) @ jackson-dataformat-xml ---
[INFO] Surefire report directory: /root/workspace/FasterXML/jackson-dataformat-xml/231036718/target/surefire-reports
[INFO] Downloading: https://repo.maven.apache.org/maven2/org/apache/maven/surefire/surefire-junit4/2.17/surefire-junit4-2.17.pom
[INFO] Downloaded: https://repo.maven.apache.org/maven2/org/apache/maven/surefire/surefire-junit4/2.17/surefire-junit4-2.17.pom (3 KB at 6.3 KB/sec)
[INFO] Downloading: https://repo.maven.apache.org/maven2/org/apache/maven/surefire/surefire-providers/2.17/surefire-providers-2.17.pom
[INFO] Downloaded: https://repo.maven.apache.org/maven2/org/apache/maven/surefire/surefire-providers/2.17/surefire-providers-2.17.pom (3 KB at 40.7 KB/sec)
[INFO] Downloading: https://repo.maven.apache.org/maven2/org/apache/maven/surefire/surefire-junit4/2.17/surefire-junit4-2.17.jar
[INFO] Downloaded: https://repo.maven.apache.org/maven2/org/apache/maven/surefire/surefire-junit4/2.17/surefire-junit4-2.17.jar (63 KB at 546.2 KB/sec)

-------------------------------------------------------
 T E S T S
-------------------------------------------------------
Running com.fasterxml.jackson.dataformat.xml.adapters.TestIssue47Attribute
Tests run: 1, Failures: 0, Errors: 0, Skipped: 0, Time elapsed: 0.381 sec - in com.fasterxml.jackson.dataformat.xml.adapters.TestIssue47Attribute
Running com.fasterxml.jackson.dataformat.xml.incr.PartialReadTest
Tests run: 1, Failures: 0, Errors: 0, Skipped: 0, Time elapsed: 0.002 sec - in com.fasterxml.jackson.dataformat.xml.incr.PartialReadTest
Running com.fasterxml.jackson.dataformat.xml.incr.IncrementalWritingTest
Tests run: 1, Failures: 0, Errors: 0, Skipped: 0, Time elapsed: 0.039 sec - in com.fasterxml.jackson.dataformat.xml.incr.IncrementalWritingTest
Running com.fasterxml.jackson.dataformat.xml.jaxb.AttributesWithJAXBTest
Tests run: 2, Failures: 0, Errors: 0, Skipped: 0, Time elapsed: 0.018 sec - in com.fasterxml.jackson.dataformat.xml.jaxb.AttributesWithJAXBTest
Running com.fasterxml.jackson.dataformat.xml.jaxb.ElementWrapperTest
Tests run: 2, Failures: 0, Errors: 0, Skipped: 0, Time elapsed: 0.015 sec - in com.fasterxml.jackson.dataformat.xml.jaxb.ElementWrapperTest
Running com.fasterxml.jackson.dataformat.xml.jaxb.JAXBObjectId170Test
Tests run: 1, Failures: 0, Errors: 0, Skipped: 0, Time elapsed: 0.042 sec - in com.fasterxml.jackson.dataformat.xml.jaxb.JAXBObjectId170Test
Running com.fasterxml.jackson.dataformat.xml.jaxb.WithJAXBAnnotationsTest
Tests run: 4, Failures: 0, Errors: 0, Skipped: 0, Time elapsed: 0.022 sec - in com.fasterxml.jackson.dataformat.xml.jaxb.WithJAXBAnnotationsTest
Running com.fasterxml.jackson.dataformat.xml.ser.TestIndentation
Tests run: 6, Failures: 0, Errors: 0, Skipped: 0, Time elapsed: 0.045 sec - in com.fasterxml.jackson.dataformat.xml.ser.TestIndentation
Running com.fasterxml.jackson.dataformat.xml.ser.TestXmlDeclaration
Tests run: 2, Failures: 0, Errors: 0, Skipped: 0, Time elapsed: 0.004 sec - in com.fasterxml.jackson.dataformat.xml.ser.TestXmlDeclaration
Running com.fasterxml.jackson.dataformat.xml.ser.TestSerializerCustom
Tests run: 1, Failures: 0, Errors: 0, Skipped: 0, Time elapsed: 0.011 sec - in com.fasterxml.jackson.dataformat.xml.ser.TestSerializerCustom
Running com.fasterxml.jackson.dataformat.xml.ser.TestNamespaces
Tests run: 1, Failures: 0, Errors: 0, Skipped: 0, Time elapsed: 0.002 sec - in com.fasterxml.jackson.dataformat.xml.ser.TestNamespaces
Running com.fasterxml.jackson.dataformat.xml.ser.TestSerializationOrdering
Tests run: 1, Failures: 0, Errors: 0, Skipped: 0, Time elapsed: 0.001 sec - in com.fasterxml.jackson.dataformat.xml.ser.TestSerializationOrdering
Running com.fasterxml.jackson.dataformat.xml.ser.TestSerializationManual
Tests run: 1, Failures: 0, Errors: 0, Skipped: 0, Time elapsed: 0.001 sec - in com.fasterxml.jackson.dataformat.xml.ser.TestSerializationManual
Running com.fasterxml.jackson.dataformat.xml.ser.TestJDKSerializability
Tests run: 2, Failures: 0, Errors: 0, Skipped: 0, Time elapsed: 0.158 sec - in com.fasterxml.jackson.dataformat.xml.ser.TestJDKSerializability
Running com.fasterxml.jackson.dataformat.xml.ser.TestSerializationAttr
Tests run: 4, Failures: 0, Errors: 0, Skipped: 0, Time elapsed: 0.013 sec - in com.fasterxml.jackson.dataformat.xml.ser.TestSerializationAttr
Running com.fasterxml.jackson.dataformat.xml.ser.TestSerialization
Tests run: 8, Failures: 0, Errors: 0, Skipped: 0, Time elapsed: 0.023 sec - in com.fasterxml.jackson.dataformat.xml.ser.TestSerialization
Running com.fasterxml.jackson.dataformat.xml.VersionInfoTest
Tests run: 4, Failures: 1, Errors: 1, Skipped: 0, Time elapsed: 0.017 sec <<< FAILURE! - in com.fasterxml.jackson.dataformat.xml.VersionInfoTest
testSerializerProviderCopy(com.fasterxml.jackson.dataformat.xml.VersionInfoTest)  Time elapsed: 0.006 sec  <<< ERROR!
java.lang.IllegalStateException: DefaultSerializerProvider sub-class not overriding copy()
	at com.fasterxml.jackson.databind.ser.DefaultSerializerProvider.copy(DefaultSerializerProvider.java:94)
	at com.fasterxml.jackson.dataformat.xml.VersionInfoTest.testSerializerProviderCopy(VersionInfoTest.java:56)

testMapperCopy(com.fasterxml.jackson.dataformat.xml.VersionInfoTest)  Time elapsed: 0.001 sec  <<< FAILURE!
junit.framework.AssertionFailedError: serialization features did not get copied expected:<2722232> but was:<2722236>
	at junit.framework.Assert.fail(Assert.java:57)
	at junit.framework.Assert.failNotEquals(Assert.java:329)
	at junit.framework.Assert.assertEquals(Assert.java:78)
	at junit.framework.Assert.assertEquals(Assert.java:234)
	at junit.framework.TestCase.assertEquals(TestCase.java:401)
	at com.fasterxml.jackson.dataformat.xml.VersionInfoTest.testMapperCopy(VersionInfoTest.java:47)

Running com.fasterxml.jackson.dataformat.xml.lists.DeserializePolyList178Test
Tests run: 1, Failures: 0, Errors: 0, Skipped: 0, Time elapsed: 0.008 sec - in com.fasterxml.jackson.dataformat.xml.lists.DeserializePolyList178Test
Running com.fasterxml.jackson.dataformat.xml.lists.ListDeser191Test
Tests run: 1, Failures: 0, Errors: 0, Skipped: 0, Time elapsed: 0.003 sec - in com.fasterxml.jackson.dataformat.xml.lists.ListDeser191Test
Running com.fasterxml.jackson.dataformat.xml.lists.ListDeserializationTest
Tests run: 5, Failures: 0, Errors: 0, Skipped: 0, Time elapsed: 0.029 sec - in com.fasterxml.jackson.dataformat.xml.lists.ListDeserializationTest
Running com.fasterxml.jackson.dataformat.xml.lists.NestedUnwrappedLists180Test
Tests run: 1, Failures: 0, Errors: 0, Skipped: 0, Time elapsed: 0.01 sec - in com.fasterxml.jackson.dataformat.xml.lists.NestedUnwrappedLists180Test
Running com.fasterxml.jackson.dataformat.xml.lists.Issue101UnwrappedListAttributesTest
Tests run: 2, Failures: 0, Errors: 0, Skipped: 0, Time elapsed: 0.01 sec - in com.fasterxml.jackson.dataformat.xml.lists.Issue101UnwrappedListAttributesTest
Running com.fasterxml.jackson.dataformat.xml.lists.ListAsObjectTest
Tests run: 1, Failures: 0, Errors: 0, Skipped: 0, Time elapsed: 0.015 sec - in com.fasterxml.jackson.dataformat.xml.lists.ListAsObjectTest
Running com.fasterxml.jackson.dataformat.xml.lists.ListSerializationTest
Tests run: 2, Failures: 0, Errors: 0, Skipped: 0, Time elapsed: 0.017 sec - in com.fasterxml.jackson.dataformat.xml.lists.ListSerializationTest
Running com.fasterxml.jackson.dataformat.xml.lists.UnwrappedListWithEmptyCData129Test
Tests run: 1, Failures: 0, Errors: 0, Skipped: 0, Time elapsed: 0.008 sec - in com.fasterxml.jackson.dataformat.xml.lists.UnwrappedListWithEmptyCData129Test
Running com.fasterxml.jackson.dataformat.xml.lists.RootListHandlingTest
Tests run: 3, Failures: 0, Errors: 0, Skipped: 0, Time elapsed: 0.037 sec - in com.fasterxml.jackson.dataformat.xml.lists.RootListHandlingTest
Running com.fasterxml.jackson.dataformat.xml.lists.WrappedListsTest
Tests run: 1, Failures: 0, Errors: 0, Skipped: 0, Time elapsed: 0.003 sec - in com.fasterxml.jackson.dataformat.xml.lists.WrappedListsTest
Running com.fasterxml.jackson.dataformat.xml.lists.EmptyListDeserTest
Tests run: 1, Failures: 0, Errors: 0, Skipped: 0, Time elapsed: 0.004 sec - in com.fasterxml.jackson.dataformat.xml.lists.EmptyListDeserTest
Running com.fasterxml.jackson.dataformat.xml.lists.ListAnnotationSharingTest
Tests run: 1, Failures: 0, Errors: 0, Skipped: 0, Time elapsed: 0.009 sec - in com.fasterxml.jackson.dataformat.xml.lists.ListAnnotationSharingTest
Running com.fasterxml.jackson.dataformat.xml.lists.ListRoundtripTest
Tests run: 3, Failures: 0, Errors: 0, Skipped: 0, Time elapsed: 0.019 sec - in com.fasterxml.jackson.dataformat.xml.lists.ListRoundtripTest
Running com.fasterxml.jackson.dataformat.xml.lists.UnwrappedListsTest
Tests run: 5, Failures: 0, Errors: 0, Skipped: 0, Time elapsed: 0.029 sec - in com.fasterxml.jackson.dataformat.xml.lists.UnwrappedListsTest
Running com.fasterxml.jackson.dataformat.xml.lists.NestedUnwrappedListsTest
Tests run: 5, Failures: 0, Errors: 0, Skipped: 0, Time elapsed: 0.017 sec - in com.fasterxml.jackson.dataformat.xml.lists.NestedUnwrappedListsTest
Running com.fasterxml.jackson.dataformat.xml.stream.FormatDetectionTest
Tests run: 8, Failures: 0, Errors: 0, Skipped: 0, Time elapsed: 0.024 sec - in com.fasterxml.jackson.dataformat.xml.stream.FormatDetectionTest
Running com.fasterxml.jackson.dataformat.xml.stream.XmlGeneratorTest
Tests run: 11, Failures: 0, Errors: 0, Skipped: 0, Time elapsed: 0.014 sec - in com.fasterxml.jackson.dataformat.xml.stream.XmlGeneratorTest
Running com.fasterxml.jackson.dataformat.xml.stream.XmlTokenStreamTest
Tests run: 4, Failures: 0, Errors: 0, Skipped: 0, Time elapsed: 0.003 sec - in com.fasterxml.jackson.dataformat.xml.stream.XmlTokenStreamTest
Running com.fasterxml.jackson.dataformat.xml.stream.XmlParserTest
Tests run: 6, Failures: 0, Errors: 0, Skipped: 0, Time elapsed: 0.02 sec - in com.fasterxml.jackson.dataformat.xml.stream.XmlParserTest
Running com.fasterxml.jackson.dataformat.xml.stream.XmlParserNextXxxTest
Tests run: 1, Failures: 0, Errors: 0, Skipped: 0, Time elapsed: 0 sec - in com.fasterxml.jackson.dataformat.xml.stream.XmlParserNextXxxTest
Running com.fasterxml.jackson.dataformat.xml.RoundtripContentTest
Tests run: 1, Failures: 0, Errors: 0, Skipped: 0, Time elapsed: 0.014 sec - in com.fasterxml.jackson.dataformat.xml.RoundtripContentTest
Running com.fasterxml.jackson.dataformat.xml.misc.NodeTest
-> {"":"first","child":"4"}
Tests run: 1, Failures: 0, Errors: 0, Skipped: 0, Time elapsed: 0.002 sec - in com.fasterxml.jackson.dataformat.xml.misc.NodeTest
Running com.fasterxml.jackson.dataformat.xml.misc.ObjectId104Test
Tests run: 1, Failures: 0, Errors: 0, Skipped: 0, Time elapsed: 0.007 sec - in com.fasterxml.jackson.dataformat.xml.misc.ObjectId104Test
Running com.fasterxml.jackson.dataformat.xml.misc.PolymorphicTypesTest
Tests run: 3, Failures: 0, Errors: 0, Skipped: 0, Time elapsed: 0.015 sec - in com.fasterxml.jackson.dataformat.xml.misc.PolymorphicTypesTest
Running com.fasterxml.jackson.dataformat.xml.misc.XmlTextTest
Tests run: 3, Failures: 0, Errors: 0, Skipped: 0, Time elapsed: 0.014 sec - in com.fasterxml.jackson.dataformat.xml.misc.XmlTextTest
Running com.fasterxml.jackson.dataformat.xml.misc.ArrayConversionsTest
Tests run: 8, Failures: 0, Errors: 0, Skipped: 0, Time elapsed: 0.044 sec - in com.fasterxml.jackson.dataformat.xml.misc.ArrayConversionsTest
Running com.fasterxml.jackson.dataformat.xml.misc.UnwrappingWithXMLTest
Tests run: 3, Failures: 0, Errors: 0, Skipped: 0, Time elapsed: 0.019 sec - in com.fasterxml.jackson.dataformat.xml.misc.UnwrappingWithXMLTest
Running com.fasterxml.jackson.dataformat.xml.misc.TextValueTest
Tests run: 6, Failures: 0, Errors: 0, Skipped: 0, Time elapsed: 0.02 sec - in com.fasterxml.jackson.dataformat.xml.misc.TextValueTest
Running com.fasterxml.jackson.dataformat.xml.misc.EmptyPolymorphicTest
Tests run: 1, Failures: 0, Errors: 0, Skipped: 0, Time elapsed: 0.005 sec - in com.fasterxml.jackson.dataformat.xml.misc.EmptyPolymorphicTest
Running com.fasterxml.jackson.dataformat.xml.misc.RootNameTest
Tests run: 2, Failures: 0, Errors: 0, Skipped: 0, Time elapsed: 0.006 sec - in com.fasterxml.jackson.dataformat.xml.misc.RootNameTest
Running com.fasterxml.jackson.dataformat.xml.deser.TestEnums
Tests run: 1, Failures: 0, Errors: 0, Skipped: 0, Time elapsed: 0.004 sec - in com.fasterxml.jackson.dataformat.xml.deser.TestEnums
Running com.fasterxml.jackson.dataformat.xml.deser.TestViews
Tests run: 3, Failures: 0, Errors: 0, Skipped: 0, Time elapsed: 0.022 sec - in com.fasterxml.jackson.dataformat.xml.deser.TestViews
Running com.fasterxml.jackson.dataformat.xml.deser.TestBinaryData
Tests run: 1, Failures: 0, Errors: 0, Skipped: 0, Time elapsed: 0.005 sec - in com.fasterxml.jackson.dataformat.xml.deser.TestBinaryData
Running com.fasterxml.jackson.dataformat.xml.deser.TestDeserialization
Tests run: 5, Failures: 0, Errors: 0, Skipped: 0, Time elapsed: 0.015 sec - in com.fasterxml.jackson.dataformat.xml.deser.TestDeserialization
Running com.fasterxml.jackson.dataformat.xml.deser.TestStringValues
Tests run: 6, Failures: 0, Errors: 0, Skipped: 0, Time elapsed: 0.006 sec - in com.fasterxml.jackson.dataformat.xml.deser.TestStringValues

Results :

Failed tests: 
  VersionInfoTest.testMapperCopy:47 serialization features did not get copied expected:<2722232> but was:<2722236>

Tests in error: 
  VersionInfoTest.testSerializerProviderCopy:56 » IllegalState DefaultSerializer...

Tests run: 150, Failures: 1, Errors: 1, Skipped: 0

[INFO] ------------------------------------------------------------------------
[INFO] BUILD FAILURE
[INFO] ------------------------------------------------------------------------
[INFO] Total time: 7.216 s
[INFO] Finished at: 2017-08-02T14:09:19+02:00
[INFO] Final Memory: 32M/907M
[INFO] ------------------------------------------------------------------------
[ERROR] Failed to execute goal org.apache.maven.plugins:maven-surefire-plugin:2.17:test (default-test) on project jackson-dataformat-xml: There are test failures.
[ERROR] 
[ERROR] Please refer to /root/workspace/FasterXML/jackson-dataformat-xml/231036718/target/surefire-reports for the individual test results.
[ERROR] -> [Help 1]
[ERROR] 
[ERROR] To see the full stack trace of the errors, re-run Maven with the -e switch.
[ERROR] Re-run Maven using the -X switch to enable full debug logging.
[ERROR] 
[ERROR] For more information about the errors and possible solutions, please read the following articles:
[ERROR] [Help 1] http://cwiki.apache.org/confluence/display/MAVEN/MojoFailureException
